{"schema_version":"1","analysis_rev":"fx-0001","producer_commit":"w0-fixture","input_artifact_hashes":{},"tracks":[{"entity_id":"P1","cls":"person","t0_ms":0,"t1_ms":10000,"cam_ids":["ceiling_00","ceiling_04","eye_00"],"pts":[[0,-4.0,-1.5,0.08,"observed"],[100,-3.91,-1.5,0.08,"observed"],[200,-3.82,-1.5,0.08,"observed"],[300,-3.73,-1.5,0.08,"observed"],[400,-3.64,-1.5,0.08,"observed"],[500,-3.55,-1.5,0.08,"observed"],[600,-3.46,-1.5,0.08,"observed"],[700,-3.37,-1.5,0.08,"observed"],[800,-3.28,-1.5,0.08,"observed"],[900,-3.19,-1.5,0.08,"observed"],[1000,-3.1,-1.5,0.08,"observed"],[1100,-3.01,-1.5,0.08,"observed"],[1200,-2.92,-1.5,0.08,"observed"],[1300,-2.83,-1.5,0.08,"observed"],[1400,-2.74,-1.5,0.08,"observed"],[1500,-2.65,-1.5,0.08,"observed"],[1600,-2.56,-1.5,0.08,"observed"],[1700,-2.47,-1.5,0.08,"observed"],[1800,-2.38,-1.5,0.08,"observed"],[1900,-2.29,-1.5,0.08,"observed"],[2000,-2.2,-1.5,0.08,"observed"],[2100,-2.11,-1.5,0.08,"observed"],[2200,-2.02,-1.5,0.08,"observed"],[2300,-1.93,-1.5,0.08,"observed"],[2400,-1.84,-1.5,0.08,"observed"],[2500,-1.75,-1.5,0.08,"observed"],[2600,-1.66,-1.5,0.08,"observed"],[2700,-1.57,-1.5,0.08,"observed"],[2800,-1.48,-1.5,0.08,"observed"],[2900,-1.39,-1.5,0.08,"observed"],[3000,-1.3,-1.5,0.08,"observed"],[3100,-1.21,-1.5,0.08,"observed"],[3200,-1.12,-1.5,0.08,"observed"],[3300,-1.03,-1.5,0.08,"observed"],[3400,-0.94,-1.5,0.08,"observed"],[3500,-0.85,-1.5,0.08,"observed"],[3600,-0.76,-1.5,0.08,"observed"],[3700,-0.67,-1.5,0.08,"observed"],[3800,-0.58,-1.5,0.08,"observed"],[3900,-0.49,-1.5,0.08,"observed"],[4000,-0.4,-1.5,0.08,"observed"],[4100,-0.31,-1.5,0.08,"observed"],[4200,-0.22,-1.5,0.08,"observed"],[4300,-0.13,-1.5,0.08,"observed"],[4400,-0.04,-1.5,0.08,"observed"],[4500,0.05,-1.5,0.08,"observed"],[4600,0.14,-1.5,0.08,"observed"],[4700,0.23,-1.42,0.08,"observed"],[4800,0.32,-1.34,0.08,"observed"],[4900,0.41,-1.26,0.08,"observed"],[5000,0.5,-1.18,0.08,"observed"],[5100,0.59,-1.1,0.08,"observed"],[5200,0.68,-1.02,0.08,"observed"],[5300,0.77,-0.94,0.08,"observed"],[5400,0.86,-0.86,0.08,"observed"],[5500,0.95,-0.78,0.08,"observed"],[5600,1.04,-0.7,0.08,"observed"],[5700,1.13,-0.7,0.08,"observed"],[5800,1.22,-0.7,0.08,"observed"],[5900,1.31,-0.7,0.08,"observed"],[6000,1.4,-0.7,0.08,"observed"],[6100,1.49,-0.7,0.08,"observed"],[6200,1.58,-0.7,0.08,"observed"],[6300,1.67,-0.7,0.08,"observed"],[6400,1.76,-0.7,0.08,"observed"],[6500,1.85,-0.7,0.08,"observed"],[6600,1.94,-0.7,0.08,"observed"],[6700,2.03,-0.7,0.08,"observed"],[6800,2.12,-0.7,0.08,"observed"],[6900,2.21,-0.7,0.08,"observed"],[7000,2.3,-0.7,0.08,"observed"],[7100,2.39,-0.7,0.08,"observed"],[7200,2.48,-0.7,0.08,"observed"],[7300,2.57,-0.7,0.08,"observed"],[7400,2.66,-0.7,0.08,"observed"],[7500,2.75,-0.7,0.08,"observed"],[7600,2.84,-0.7,0.08,"observed"],[7700,2.93,-0.7,0.08,"observed"],[7800,3.02,-0.7,0.08,"observed"],[7900,3.11,-0.7,0.08,"observed"],[8000,3.2,-0.7,0.08,"observed"],[8100,3.29,-0.7,0.08,"observed"],[8200,3.38,-0.7,0.08,"observed"],[8300,3.47,-0.7,0.08,"observed"],[8400,3.56,-0.7,0.08,"observed"],[8500,3.65,-0.7,0.08,"observed"],[8600,3.74,-0.7,0.08,"observed"],[8700,3.83,-0.7,0.08,"observed"],[8800,3.92,-0.7,0.08,"observed"],[8900,4.01,-0.7,0.08,"observed"],[9000,4.1,-0.7,0.08,"observed"],[9100,4.19,-0.7,0.08,"observed"],[9200,4.28,-0.7,0.08,"observed"],[9300,4.37,-0.7,0.08,"observed"],[9400,4.46,-0.7,0.08,"observed"],[9500,4.55,-0.7,0.08,"observed"],[9600,4.64,-0.7,0.08,"observed"],[9700,4.73,-0.7,0.08,"observed"],[9800,4.82,-0.7,0.08,"observed"],[9900,4.91,-0.7,0.08,"observed"]],"source":"tri"},{"entity_id":"P2","cls":"person","t0_ms":0,"t1_ms":10000,"cam_ids":["ceiling_00","ceiling_04","eye_00"],"pts":[[0,5.0,3.0,0.08,"observed"],[100,4.93,3.005,0.08,"observed"],[200,4.86,3.01,0.08,"observed"],[300,4.79,3.015,0.08,"observed"],[400,4.72,3.02,0.08,"observed"],[500,4.65,3.025,0.08,"observed"],[600,4.58,3.03,0.08,"observed"],[700,4.51,3.035,0.08,"observed"],[800,4.44,3.04,0.08,"observed"],[900,4.37,3.045,0.08,"observed"],[1000,4.3,3.05,0.08,"observed"],[1100,4.23,3.055,0.08,"observed"],[1200,4.16,3.06,0.08,"observed"],[1300,4.09,3.065,0.08,"observed"],[1400,4.02,3.07,0.08,"observed"],[1500,3.95,3.075,0.08,"observed"],[1600,3.88,3.08,0.08,"observed"],[1700,3.81,3.085,0.08,"observed"],[1800,3.74,3.09,0.08,"observed"],[1900,3.67,3.095,0.08,"observed"],[2000,3.6,3.1,0.35,"observed"],[2100,3.53,3.105,0.35,"observed"],[2200,3.46,3.11,0.35,"observed"],[2300,3.39,3.115,0.08,"observed"],[2400,3.32,3.12,0.08,"observed"],[2500,3.25,3.125,0.08,"observed"],[2600,3.18,3.13,0.08,"observed"],[2700,3.11,3.135,0.08,"observed"],[2800,3.04,3.14,0.08,"observed"],[2900,2.97,3.145,0.08,"observed"],[3000,2.9,3.15,0.08,"observed"],[3100,2.83,3.155,0.08,"observed"],[3200,2.76,3.16,0.08,"observed"],[3300,2.69,3.165,0.08,"observed"],[3400,2.62,3.17,0.08,"observed"],[3500,2.55,3.175,0.08,"observed"],[3600,2.48,3.18,0.08,"observed"],[3700,2.41,3.185,0.08,"observed"],[3800,2.34,3.19,0.08,"observed"],[3900,2.27,3.195,0.08,"observed"],[4000,2.2,3.2,0.08,"observed"],[4100,2.13,3.205,0.08,"observed"],[4200,2.06,3.21,0.08,"observed"],[4300,1.99,3.215,0.08,"observed"],[4400,1.92,3.22,0.08,"observed"],[4500,1.85,3.225,0.08,"observed"],[4600,1.78,3.23,0.08,"observed"],[4700,1.71,3.235,0.08,"observed"],[4800,1.64,3.24,0.08,"observed"],[4900,1.57,3.245,0.08,"observed"],[5000,1.5,3.25,0.08,"observed"],[5100,1.43,3.255,0.08,"observed"],[5200,1.36,3.26,0.08,"observed"],[5300,1.29,3.265,0.08,"observed"],[5400,1.22,3.27,0.08,"observed"],[5500,1.15,3.275,0.08,"observed"],[5600,1.08,3.28,0.08,"observed"],[5700,1.01,3.285,0.08,"observed"],[5800,0.94,3.29,0.08,"observed"],[5900,0.87,3.295,0.08,"observed"],[6000,0.8,3.3,0.35,"observed"],[6100,0.73,3.305,0.35,"observed"],[6200,0.66,3.31,0.35,"observed"],[6300,0.59,3.315,0.35,"observed"],[6400,0.52,3.32,0.35,"observed"],[6500,0.45,3.325,0.35,"observed"],[6600,0.38,3.33,0.35,"observed"],[6700,0.31,3.335,0.35,"observed"],[6800,0.24,3.34,0.35,"observed"],[6900,0.17,3.345,0.35,"observed"],[7000,0.1,3.35,0.08,"observed"],[7100,0.03,3.355,0.08,"observed"],[7200,-0.04,3.36,0.08,"observed"],[7300,-0.11,3.365,0.08,"observed"],[7400,-0.18,3.37,0.08,"observed"],[7500,-0.25,3.375,0.08,"observed"],[7600,-0.32,3.38,0.08,"observed"],[7700,-0.39,3.385,0.08,"observed"],[7800,-0.46,3.39,0.08,"observed"],[7900,-0.53,3.395,0.08,"observed"],[8000,-0.6,3.4,0.08,"observed"],[8100,-0.67,3.405,0.08,"observed"],[8200,-0.74,3.41,0.08,"observed"],[8300,-0.81,3.415,0.08,"observed"],[8400,-0.88,3.42,0.08,"observed"],[8500,-0.95,3.425,0.08,"observed"],[8600,-1.02,3.43,0.08,"observed"],[8700,-1.09,3.435,0.08,"observed"],[8800,-1.16,3.44,0.08,"observed"],[8900,-1.23,3.445,0.08,"observed"],[9000,-1.3,3.45,0.08,"observed"],[9100,-1.37,3.455,0.08,"observed"],[9200,-1.44,3.46,0.08,"observed"],[9300,-1.51,3.465,0.08,"observed"],[9400,-1.58,3.47,0.08,"observed"],[9500,-1.65,3.475,0.08,"observed"],[9600,-1.72,3.48,0.08,"observed"],[9700,-1.79,3.485,0.08,"observed"],[9800,-1.86,3.49,0.08,"observed"],[9900,-1.93,3.495,0.08,"observed"]],"source":"tri"},{"entity_id":"F1","cls":"forklift","t0_ms":0,"t1_ms":10000,"cam_ids":["ceiling_00","ceiling_04","eye_00"],"pts":[[0,5.0,-2.5,0.15,"observed"],[100,4.92,-2.5,0.15,"observed"],[200,4.84,-2.5,0.15,"observed"],[300,4.76,-2.5,0.15,"observed"],[400,4.68,-2.5,0.15,"observed"],[500,4.6,-2.5,0.15,"observed"],[600,4.52,-2.5,0.15,"observed"],[700,4.44,-2.5,0.15,"observed"],[800,4.36,-2.5,0.15,"observed"],[900,4.28,-2.5,0.15,"observed"],[1000,4.2,-2.5,0.15,"observed"],[1100,4.12,-2.5,0.15,"observed"],[1200,4.04,-2.5,0.15,"observed"],[1300,3.96,-2.5,0.15,"observed"],[1400,3.88,-2.5,0.15,"observed"],[1500,3.8,-2.5,0.15,"observed"],[1600,3.72,-2.5,0.15,"observed"],[1700,3.64,-2.5,0.15,"observed"],[1800,3.56,-2.5,0.15,"observed"],[1900,3.48,-2.5,0.15,"observed"],[2000,3.4,-2.5,0.15,"observed"],[2100,3.32,-2.5,0.15,"observed"],[2200,3.24,-2.5,0.15,"observed"],[2300,3.16,-2.5,0.15,"observed"],[2400,3.08,-2.5,0.15,"observed"],[2500,3.0,-2.5,0.15,"observed"],[2600,2.92,-2.5,0.15,"observed"],[2700,2.84,-2.5,0.15,"observed"],[2800,2.76,-2.5,0.15,"observed"],[2900,2.68,-2.5,0.15,"observed"],[3000,2.6,-2.5,0.15,"observed"],[3100,2.52,-2.5,0.15,"observed"],[3200,2.44,-2.5,0.15,"observed"],[3300,2.36,-2.5,0.15,"observed"],[3400,2.28,-2.5,0.15,"observed"],[3500,2.2,-2.5,0.15,"observed"],[3600,2.12,-2.5,0.15,"observed"],[3700,2.04,-2.5,0.15,"observed"],[3800,1.96,-2.5,0.15,"observed"],[3900,1.88,-2.5,0.15,"observed"],[4000,1.8,-2.5,0.15,"observed"],[4100,1.72,-2.5,0.15,"observed"],[4200,1.64,-2.5,0.15,"observed"],[4300,1.56,-2.5,0.15,"observed"],[4400,1.48,-2.5,0.15,"observed"],[4500,1.4,-2.5,0.15,"observed"],[4600,1.32,-2.5,0.15,"observed"],[4700,1.24,-2.5,0.15,"observed"],[4800,1.16,-2.5,0.15,"observed"],[4900,1.08,-2.5,0.15,"observed"],[5000,1.0,-2.5,0.15,"observed"],[5100,0.92,-2.5,0.15,"observed"],[5200,0.84,-2.5,0.15,"observed"],[5300,0.76,-2.5,0.15,"observed"],[5400,0.68,-2.5,0.15,"observed"],[5500,0.6,-2.5,0.15,"observed"],[5600,0.52,-2.5,0.15,"observed"],[5700,0.44,-2.5,0.15,"observed"],[5800,0.36,-2.5,0.15,"observed"],[5900,0.28,-2.5,0.15,"observed"],[6000,0.2,-2.5,0.15,"observed"],[6100,0.12,-2.5,0.15,"observed"],[6200,0.04,-2.5,0.15,"observed"],[6300,-0.04,-2.5,0.15,"observed"],[6400,-0.12,-2.5,0.15,"observed"],[6500,-0.2,-2.5,0.15,"observed"],[6600,-0.28,-2.5,0.15,"observed"],[6700,-0.36,-2.5,0.15,"observed"],[6800,-0.44,-2.5,0.15,"observed"],[6900,-0.52,-2.5,0.15,"observed"],[7000,-0.6,-2.5,0.15,"observed"],[7100,-0.68,-2.5,0.15,"observed"],[7200,-0.76,-2.5,0.15,"observed"],[7300,-0.84,-2.5,0.15,"observed"],[7400,-0.92,-2.5,0.15,"observed"],[7500,-1.0,-2.5,0.15,"observed"],[7600,-1.08,-2.5,0.15,"observed"],[7700,-1.16,-2.5,0.15,"observed"],[7800,-1.24,-2.5,0.15,"observed"],[7900,-1.32,-2.5,0.15,"observed"],[8000,-1.4,-2.5,0.15,"observed"],[8100,-1.48,-2.5,0.15,"observed"],[8200,-1.56,-2.5,0.15,"observed"],[8300,-1.64,-2.5,0.15,"observed"],[8400,-1.72,-2.5,0.15,"observed"],[8500,-1.8,-2.5,0.15,"observed"],[86